{
  "schemaVersion": 1,
  "vtkVersion": "9.7.0",
  "platform": "windows-x64",
  "configuration": "Release",
  "modules": [
    {"module": "vtkCommonColor", "depends": ["VTK::CommonCore","VTK::CommonDataModel"], "privateDepends": [], "optionalDepends": [], "implements": [], "implementable": false, "libraryName": "vtkCommonColor", "needsAutoinit": false},
    {"module": "vtkCommonComputationalGeometry", "depends": ["VTK::CommonCore","VTK::CommonDataModel"], "privateDepends": [], "optionalDepends": [], "implements": [], "implementable": false, "libraryName": "vtkCommonComputationalGeometry", "needsAutoinit": false},
    {"module": "vtkCommonCore", "depends": ["VTK::fast_float","VTK::fmt","VTK::kwiml","VTK::nlohmannjson","VTK::scn","VTK::token","VTK::vtksys"], "privateDepends": [], "optionalDepends": ["VTK::loguru"], "implements": [], "implementable": false, "libraryName": "vtkCommonCore", "needsAutoinit": false},
    {"module": "vtkCommonDataModel", "depends": ["VTK::CommonCore","VTK::CommonMath","VTK::CommonTransforms"], "privateDepends": ["VTK::CommonMisc","VTK::CommonSystem","VTK::pegtl","VTK::pugixml","VTK::vtksys"], "optionalDepends": [], "implements": [], "implementable": false, "libraryName": "vtkCommonDataModel", "needsAutoinit": false},
    {"module": "vtkCommonExecutionModel", "depends": ["VTK::CommonCore","VTK::CommonDataModel"], "privateDepends": ["VTK::CommonMisc","VTK::CommonSystem"], "optionalDepends": [], "implements": [], "implementable": false, "libraryName": "vtkCommonExecutionModel", "needsAutoinit": false},
    {"module": "vtkCommonMath", "depends": ["VTK::CommonCore","VTK::kissfft"], "privateDepends": [], "optionalDepends": [], "implements": [], "implementable": false, "libraryName": "vtkCommonMath", "needsAutoinit": false},
    {"module": "vtkCommonTransforms", "depends": ["VTK::CommonCore","VTK::CommonMath"], "privateDepends": ["VTK::vtksys"], "optionalDepends": [], "implements": [], "implementable": false, "libraryName": "vtkCommonTransforms", "needsAutoinit": false},
    {"module": "vtkFiltersCore", "depends": ["VTK::CommonCore","VTK::CommonDataModel","VTK::CommonExecutionModel","VTK::CommonMisc"], "privateDepends": ["VTK::CommonCache","VTK::CommonMath","VTK::CommonSystem","VTK::CommonTransforms","VTK::FiltersReduction","VTK::vtksys"], "optionalDepends": [], "implements": [], "implementable": true, "libraryName": "vtkFiltersCore", "needsAutoinit": true},
    {"module": "vtkFiltersExtraction", "depends": ["VTK::CommonCore","VTK::CommonExecutionModel","VTK::FiltersGeneral"], "privateDepends": ["VTK::CommonCache","VTK::CommonDataModel","VTK::FiltersCore","VTK::FiltersHyperTree","VTK::FiltersStatistics","VTK::ParallelDIY"], "optionalDepends": ["VTK::ParallelMPI"], "implements": [], "implementable": false, "libraryName": "vtkFiltersExtraction", "needsAutoinit": false},
    {"module": "vtkFiltersGeneral", "depends": ["VTK::CommonCore","VTK::CommonDataModel","VTK::CommonExecutionModel","VTK::CommonMisc","VTK::FiltersCore"], "privateDepends": ["VTK::CommonCache","VTK::CommonComputationalGeometry","VTK::CommonMath","VTK::CommonSystem","VTK::CommonTransforms","VTK::FiltersGeometry","VTK::FiltersVerdict","VTK::fmt"], "optionalDepends": [], "implements": [], "implementable": false, "libraryName": "vtkFiltersGeneral", "needsAutoinit": false},
    {"module": "vtkFiltersGeometry", "depends": ["VTK::CommonCore","VTK::CommonDataModel","VTK::CommonExecutionModel"], "privateDepends": ["VTK::FiltersCore","VTK::vtksys"], "optionalDepends": [], "implements": [], "implementable": false, "libraryName": "vtkFiltersGeometry", "needsAutoinit": false},
    {"module": "vtkFiltersModeling", "depends": ["VTK::CommonExecutionModel","VTK::CommonMisc","VTK::FiltersGeneral"], "privateDepends": ["VTK::CommonCore","VTK::CommonDataModel","VTK::CommonTransforms","VTK::FiltersCore","VTK::FiltersSources"], "optionalDepends": [], "implements": [], "implementable": false, "libraryName": "vtkFiltersModeling", "needsAutoinit": false},
    {"module": "vtkFiltersPoints", "depends": ["VTK::CommonCore","VTK::CommonExecutionModel","VTK::CommonMisc","VTK::FiltersModeling"], "privateDepends": [], "optionalDepends": [], "implements": [], "implementable": false, "libraryName": "vtkFiltersPoints", "needsAutoinit": false},
    {"module": "vtkFiltersSources", "depends": ["VTK::CommonDataModel","VTK::CommonExecutionModel"], "privateDepends": ["VTK::CommonComputationalGeometry","VTK::CommonCore","VTK::CommonTransforms","VTK::FiltersCore","VTK::FiltersGeneral"], "optionalDepends": [], "implements": [], "implementable": false, "libraryName": "vtkFiltersSources", "needsAutoinit": false},
    {"module": "vtkFiltersVerdict", "depends": ["VTK::CommonExecutionModel"], "privateDepends": ["VTK::CommonCore","VTK::CommonDataModel","VTK::FiltersCore","VTK::FiltersGeometry","VTK::verdict"], "optionalDepends": [], "implements": [], "implementable": false, "libraryName": "vtkFiltersVerdict", "needsAutoinit": false},
    {"module": "vtkIOCore", "depends": ["VTK::CommonCore","VTK::CommonExecutionModel"], "privateDepends": ["VTK::CommonDataModel","VTK::CommonMisc","VTK::lz4","VTK::lzma","VTK::utf8","VTK::vtksys","VTK::zlib","VTK::fast_float"], "optionalDepends": [], "implements": [], "implementable": false, "libraryName": "vtkIOCore", "needsAutoinit": false},
    {"module": "vtkIOGeometry", "depends": ["VTK::CommonCore","VTK::CommonDataModel","VTK::CommonExecutionModel","VTK::IOCore","VTK::IOLegacy","VTK::nlohmannjson"], "privateDepends": ["VTK::CommonMisc","VTK::CommonSystem","VTK::CommonTransforms","VTK::FiltersGeneral","VTK::FiltersHybrid","VTK::FiltersVerdict","VTK::ImagingCore","VTK::IOImage","VTK::RenderingCore","VTK::vtksys","VTK::zlib"], "optionalDepends": [], "implements": [], "implementable": true, "libraryName": "vtkIOGeometry", "needsAutoinit": true},
    {"module": "vtkIOImage", "depends": ["VTK::CommonCore","VTK::CommonExecutionModel","VTK::IOCore","VTK::ImagingCore"], "privateDepends": ["VTK::CommonDataModel","VTK::CommonMath","VTK::CommonMisc","VTK::CommonSystem","VTK::CommonTransforms","VTK::DICOMParser","VTK::jpeg","VTK::metaio","VTK::png","VTK::pugixml","VTK::tiff","VTK::vtksys","VTK::zlib"], "optionalDepends": [], "implements": [], "implementable": true, "libraryName": "vtkIOImage", "needsAutoinit": true},
    {"module": "vtkIOInfovis", "depends": ["VTK::CommonCore","VTK::CommonExecutionModel","VTK::IOLegacy","VTK::IOXML"], "privateDepends": ["VTK::CommonDataModel","VTK::CommonMisc","VTK::IOCore","VTK::IOXMLParser","VTK::InfovisCore","VTK::libxml2","VTK::vtksys","VTK::utf8"], "optionalDepends": [], "implements": [], "implementable": false, "libraryName": "vtkIOInfovis", "needsAutoinit": false},
    {"module": "vtkIOXML", "depends": ["VTK::CommonCore","VTK::CommonExecutionModel","VTK::IOXMLParser"], "privateDepends": ["VTK::CommonDataModel","VTK::CommonMisc","VTK::CommonSystem","VTK::IOCore","VTK::vtksys"], "optionalDepends": [], "implements": [], "implementable": false, "libraryName": "vtkIOXML", "needsAutoinit": false},
    {"module": "vtkImagingCore", "depends": ["VTK::CommonCore","VTK::CommonDataModel","VTK::CommonExecutionModel"], "privateDepends": ["VTK::CommonMath","VTK::CommonTransforms"], "optionalDepends": [], "implements": [], "implementable": false, "libraryName": "vtkImagingCore", "needsAutoinit": false},
    {"module": "vtkImagingMath", "depends": ["VTK::CommonExecutionModel"], "privateDepends": ["VTK::CommonCore","VTK::CommonDataModel"], "optionalDepends": [], "implements": [], "implementable": false, "libraryName": "vtkImagingMath", "needsAutoinit": false},
    {"module": "vtkInteractionImage", "depends": ["VTK::CommonCore","VTK::RenderingCore"], "privateDepends": ["VTK::CommonDataModel","VTK::CommonExecutionModel","VTK::ImagingColor","VTK::ImagingCore","VTK::InteractionStyle","VTK::InteractionWidgets"], "optionalDepends": [], "implements": [], "implementable": false, "libraryName": "vtkInteractionImage", "needsAutoinit": false},
    {"module": "vtkInteractionStyle", "depends": ["VTK::CommonDataModel","VTK::RenderingCore"], "privateDepends": ["VTK::CommonCore","VTK::CommonMath","VTK::CommonSystem","VTK::CommonTransforms","VTK::FiltersCore","VTK::FiltersExtraction","VTK::FiltersSources"], "optionalDepends": [], "implements": ["VTK::RenderingCore"], "implementable": false, "libraryName": "vtkInteractionStyle", "needsAutoinit": true},
    {"module": "vtkInteractionWidgets", "depends": ["VTK::CommonCore","VTK::CommonExecutionModel","VTK::FiltersGeneral","VTK::FiltersSources","VTK::RenderingCore","VTK::RenderingContext2D"], "privateDepends": ["VTK::CommonComputationalGeometry","VTK::CommonDataModel","VTK::CommonMath","VTK::CommonSystem","VTK::CommonTransforms","VTK::FiltersCore","VTK::FiltersHybrid","VTK::FiltersModeling","VTK::FiltersTexture","VTK::ImagingColor","VTK::ImagingCore","VTK::ImagingGeneral","VTK::ImagingHybrid","VTK::InteractionStyle","VTK::RenderingAnnotation","VTK::RenderingFreeType","VTK::RenderingVolume"], "optionalDepends": [], "implements": [], "implementable": false, "libraryName": "vtkInteractionWidgets", "needsAutoinit": false},
    {"module": "vtkRenderingAnnotation", "depends": ["VTK::CommonCore","VTK::CommonDataModel","VTK::CommonExecutionModel","VTK::RenderingCore"], "privateDepends": ["VTK::CommonMath","VTK::CommonTransforms","VTK::FiltersCore","VTK::FiltersGeneral","VTK::FiltersSources","VTK::ImagingColor","VTK::RenderingFreeType"], "optionalDepends": [], "implements": [], "implementable": false, "libraryName": "vtkRenderingAnnotation", "needsAutoinit": false},